{
  "$schema": "./schemas/collection.schema.json",
  "config_name": "collection",
  "version": "1.0.0",
  "collection": {
    "id": "1fdf2873-db1f-41e1-9b6c-22cc6bac732f",
    "name": "The Sinking Ship",
    "description": "44,444 hand-drawn Amano-style salvage records from the wreck everyone abandoned. The world sees a sinking ship. You see a salvage operation. Hope never sinks.",
    "icon": "https://flipthiscrypto.github.io/The-Sinking-Ship/assets/brand/icon.jpg",
    "banner": "https://flipthiscrypto.github.io/The-Sinking-Ship/assets/brand/banner.jpg",
    "twitter": "@FlipThisCrypto",
    "website": "https://flipthiscrypto.github.io/The-Sinking-Ship/",
    "license_url": "https://raw.githubusercontent.com/FlipThisCrypto/The-Sinking-Ship/main/LICENSE"
  },
  "minting": {
    "minting_tool": "sinking-ship-shipgen-1.0.0",
    "series_total": 44444,
    "royalty_percentage_basis_points": 1000,
    "did": "did:chia:18uwh9krvd4et69ps3ydspy9nt66wxw595ws0geuw0zxy86vxwa5qp42x20",
    "royalty_address": "xch1kdzqtkpd42n2avcr6qwdvj69fjn97xl555v0lkpvfg84gdfuchsqee3j04"
  },
  "notes": [
    "OQ-8 RESOLVED (owner 2026-07-21): collection.id is the CHIP-0007 UUID 1fdf2873-db1f-41e1-9b6c-22cc6bac732f. Chain identity (DID, royalty address, 10% = 1000 bp) supplied by owner and validated by engine/shipgen/identity.py (gated in validate_configs + ops_preflight).",
    "OQ-9: series_total is the 44,444 cap; under The Scuttling the realized supply will be lower. CHIP-0007 has no post-hoc mutation story — series_total is committed pre-mint at the cap. Flagged for the fairness docs.",
    "icon/banner are the owner's official Bepe art, optimized by scripts/build_brand_assets.py into site/assets/brand/ and served from GitHub Pages until a custom domain / IPFS cutover."
  ]
}
